{
  "$schema": "https://json-schema.org/draft/2020-12/schema",
  "$id": "https://local/schemas/statement_pack.schema.json",
  "title": "StatementPack",
  "type": "object",
  "additionalProperties": false,
  "required": [
    "schema_version",
    "company_name",
    "source",
    "currency",
    "unit_scale",
    "periods",
    "items",
    "warnings"
  ],
  "properties": {
    "schema_version": { "type": "string", "const": "1.0.0" },
    "company_name": { "type": ["string", "null"] },
    "source": {
      "type": "object",
      "additionalProperties": false,
      "required": ["filename", "page_count"],
      "properties": {
        "filename": { "type": "string" },
        "page_count": { "type": "integer", "minimum": 1 },
        "parser_engines": {
          "type": "array",
          "items": { "type": "string" }
        }
      }
    },
    "currency": { "type": "string", "minLength": 3, "maxLength": 3 },
    "unit_scale": {
      "type": "integer",
      "enum": [1, 1000, 1000000],
      "description": "1 = as printed pounds/dollars, 1000 = thousands, 1000000 = millions"
    },
    "periods": {
      "type": "array",
      "minItems": 1,
      "items": {
        "type": "object",
        "additionalProperties": false,
        "required": ["id", "label", "end_date"],
        "properties": {
          "id": { "type": "string" },
          "label": { "type": "string" },
          "end_date": { "type": ["string", "null"] },
          "is_restated": { "type": "boolean", "default": false }
        }
      }
    },
    "items": {
      "type": "object",
      "description": "Canonical line items. Missing items must still appear with null values if expected by ratios.",
      "additionalProperties": { "$ref": "#/$defs/line_item" },
      "properties": {
        "revenue": { "$ref": "#/$defs/line_item" },
        "operating_profit": { "$ref": "#/$defs/line_item" },
        "profit_before_tax": { "$ref": "#/$defs/line_item" },
        "net_income": { "$ref": "#/$defs/line_item" },
        "current_assets": { "$ref": "#/$defs/line_item" },
        "current_liabilities": { "$ref": "#/$defs/line_item" },
        "total_assets": { "$ref": "#/$defs/line_item" },
        "total_equity": { "$ref": "#/$defs/line_item" },
        "total_debt": { "$ref": "#/$defs/line_item" },
        "cash": { "$ref": "#/$defs/line_item" }
      }
    },
    "warnings": {
      "type": "array",
      "items": {
        "type": "object",
        "additionalProperties": false,
        "required": ["code", "message"],
        "properties": {
          "code": {
            "type": "string",
            "enum": [
              "missing_item",
              "low_confidence",
              "parser_disagreement",
              "unit_ambiguous",
              "sign_ambiguous",
              "multi_page_table",
              "restated_comparative",
              "alias_weak",
              "bank_layout",
              "public_sector_layout"
            ]
          },
          "message": { "type": "string" },
          "item": { "type": ["string", "null"] },
          "page": { "type": ["integer", "null"] }
        }
      }
    }
  },
  "$defs": {
    "line_item": {
      "type": "object",
      "additionalProperties": false,
      "required": ["id", "values"],
      "properties": {
        "id": { "type": "string" },
        "label_found": { "type": ["string", "null"] },
        "statement": {
          "type": ["string", "null"],
          "enum": ["income_statement", "balance_sheet", "other", null]
        },
        "values": {
          "type": "array",
          "items": { "$ref": "#/$defs/period_value" }
        }
      }
    },
    "period_value": {
      "type": "object",
      "additionalProperties": false,
      "required": ["period_id", "value", "confidence"],
      "properties": {
        "period_id": { "type": "string" },
        "value": { "type": ["number", "null"] },
        "page": { "type": ["integer", "null"] },
        "raw_text": { "type": ["string", "null"] },
        "confidence": { "type": "number", "minimum": 0, "maximum": 1 },
        "engine": { "type": ["string", "null"] }
      }
    }
  }
}
